{"$schema":"https://litheview.dev/schema/display-definition.schema.json","schemaVersion":2,"id":"litheview.project.first-display.surface","displayName":"First Display display","geometry":{"width":480,"height":272,"shape":"rectangle","rotationDegrees":0,"safeArea":{"x":0,"y":0,"width":480,"height":272}},"addressSpace":"pixels","format":"rgb565","storageBlock":{"width":1,"height":1,"bytes":2},"channelModel":"rgb","fields":[{"channel":"red","bitOffset":11,"bitWidth":5,"position":{"x":0,"y":0}},{"channel":"green","bitOffset":5,"bitWidth":6,"position":{"x":0,"y":0}},{"channel":"blue","bitOffset":0,"bitWidth":5,"position":{"x":0,"y":0}}],"composition":{"sourceAlpha":true,"coverage":true,"sourceOver":true,"destinationAlpha":false},"resourceFormats":["alpha1","alpha8","argb8888","indexed4","r2Packed2x2","rgb565","rgb888","xrgb8888"],"source":{"status":"unverified","reference":"Rocktech RK043FN48H-CT672B product specification page","sha256":null}}