{
  "$schema": "../../schema/display-definition.schema.json",
  "schemaVersion": 2,
  "id": "litheview.definition.software.rk043fn48h-xrgb8888",
  "displayName": "rk043fn48h-xrgb8888 compiled software surface",
  "geometry": {
    "width": 480,
    "height": 272,
    "shape": "rectangle",
    "rotationDegrees": 0,
    "safeArea": {
      "x": 0,
      "y": 0,
      "width": 480,
      "height": 272
    }
  },
  "addressSpace": "pixels",
  "format": "xrgb8888",
  "storageBlock": {
    "width": 1,
    "height": 1,
    "bytes": 4
  },
  "channelModel": "rgb",
  "fields": [
    {
      "channel": "red",
      "bitOffset": 16,
      "bitWidth": 8,
      "position": {
        "x": 0,
        "y": 0
      }
    },
    {
      "channel": "green",
      "bitOffset": 8,
      "bitWidth": 8,
      "position": {
        "x": 0,
        "y": 0
      }
    },
    {
      "channel": "blue",
      "bitOffset": 0,
      "bitWidth": 8,
      "position": {
        "x": 0,
        "y": 0
      }
    },
    {
      "channel": "unused",
      "bitOffset": 24,
      "bitWidth": 8,
      "position": {
        "x": 0,
        "y": 0
      }
    }
  ],
  "composition": {
    "sourceAlpha": true,
    "coverage": true,
    "sourceOver": true,
    "destinationAlpha": false
  },
  "resourceFormats": [
    "alpha1",
    "alpha8",
    "indexed4",
    "rgb565",
    "rgb888",
    "xrgb8888",
    "argb8888",
    "r2Packed2x2"
  ],
  "source": {
    "status": "softwareContract",
    "reference": "Repository software packing and geometry contract; physical panel source verification is separate.",
    "sha256": null
  }
}
