{
  "$schema": "../../schema/display-definition.schema.json",
  "schemaVersion": 2,
  "id": "litheview.definition.software.synthetic-red-cell",
  "displayName": "Synthetic storage test: red-cell",
  "geometry": {
    "width": 256,
    "height": 192,
    "shape": "rectangle",
    "rotationDegrees": 0,
    "safeArea": {
      "x": 0,
      "y": 0,
      "width": 256,
      "height": 192
    }
  },
  "addressSpace": "cells",
  "format": "rrrr2222",
  "storageBlock": {
    "width": 1,
    "height": 1,
    "bytes": 1
  },
  "channelModel": "red",
  "fields": [
    {
      "channel": "red",
      "bitOffset": 2,
      "bitWidth": 2,
      "position": {
        "x": 0,
        "y": 0
      }
    },
    {
      "channel": "red",
      "bitOffset": 6,
      "bitWidth": 2,
      "position": {
        "x": 1,
        "y": 0
      }
    },
    {
      "channel": "red",
      "bitOffset": 0,
      "bitWidth": 2,
      "position": {
        "x": 0,
        "y": 1
      }
    },
    {
      "channel": "red",
      "bitOffset": 4,
      "bitWidth": 2,
      "position": {
        "x": 1,
        "y": 1
      }
    }
  ],
  "composition": {
    "sourceAlpha": true,
    "coverage": true,
    "sourceOver": true,
    "destinationAlpha": false
  },
  "resourceFormats": [
    "alpha1",
    "indexed4",
    "r2Packed2x2"
  ],
  "source": {
    "status": "softwareContract",
    "reference": "Synthetic geometry testing the generic storage contract; no physical display or controller is represented.",
    "sha256": null
  }
}
